URL,Version,Status,OIDs,Name,Title,Description,Used
http://snomed.info/sct,null,active,"2.16.840.1.113883.6.96",SNOMED_CT,SNOMED CT (all versions),"SNOMED CT is the most comprehensive and precise clinical health terminology product in the world, owned and distributed around the world by The International Health Terminology Standards Development Organisation (IHTSDO).","ValueSet/referencerange-appliesto,ValueSet/body-site"
http://terminology.hl7.org/CodeSystem/PHOccupationalDataForHealthODH,2.0.1,active,"2.16.840.1.114222.4.5.327",PHOccupationalDataForHealthODH,Occupational Data for Health (ODH),"The concepts representing the values supporting Occupational Data for Health, including Job Supervisory Level or Pay Grade (ODH) code system consists of data elements that describe a person's work information, structured to facilitate individual, population, and public health use; not intended to support billing.).","ConceptMap/IHE-PCC-ODH-ISCO08-to-SOC2010-Concept-Mapping,ValueSet/2.16.840.1.114222.4.11.7613,ConceptMap/IHE-PCC-ODH-SOC2010-to-ISCO08-Concept-Mapping"
http://terminology.hl7.org/CodeSystem/referencerange-meaning,1.0.1,active,"2.16.840.1.113883.4.642.1.1124",ObservationReferenceRangeMeaningCodes,Observation Reference Range Meaning Codes,"This value set defines a set of codes that can be used to indicate the meaning/use of a reference range for a particular target population.","ValueSet/referencerange-meaning"
http://terminology.hl7.org/CodeSystem/v3-ObservationValue,4.0.0,active,"2.16.840.1.113883.5.1063",ObservationValue,ObservationValue,"This code system covers all concepts of HL7-defined values for the Observation value element, when it has a coded datatype.","ValueSet/v3-WorkScheduleODH,ValueSet/v3-employmentStatusODH"
http://terminology.hl7.org/CodeSystem/v3-WorkClassificationODH,3.0.0,active,"2.16.840.1.113883.5.1139",WorkClassificationODH,Work Classification (Occupational Data for Health),"Code system of concepts representing a person's job type as defined by compensation and sector (e.g. paid vs. unpaid, self-employed vs. not self-employed, government vs. private, etc.).","ValueSet/v3-WorkClassificationODH"
https://profiles.ihe.net/PCC/ODH/CodeSystem/ISCO08,1.0.0,active,"1.3.6.1.4.1.19376.1.5.3.1.3.43.16.1",InternationalClassificationOfOccupations2008,International Classification Of Occupations 2008,"The International Classification of Occupations (ISCO) seeks to facilitate international communication about occupations by providing statisticians with a framework to make internationally comparable occupational data available, and by allowing international occupational data to be produced in a form that can be useful for research as well as for specific decision-making and action-oriented activities. The current version, known as ISCO-08, was published in 2008 and is the fourth iteration, following ISCO-58, ISCO-68 and ISCO-88. Published by IHE with authority from the International Labor Organization Given on July 18th 2024. This code system will be removed if and when a more formal publication is taken on by this organization.  ","ConceptMap/IHE-PCC-ODH-ISCO08-to-SOC2010-Concept-Mapping,ConceptMap/IHE-PCC-ODH-SOC2010-to-ISCO08-Concept-Mapping"
