URL,Version,Status,OIDs,Name,Title,Description,Used
http://hl7.org/fhir/document-reference-status,5.0.0,draft,"2.16.840.1.113883.4.642.4.8",DocumentReferenceStatus,DocumentReferenceStatus,"The status of the document reference.","ConceptMap/FhirStatusVsStatusCode,ValueSet/DocumentReferenceStats"
http://hl7.org/fhir/document-relationship-type,5.0.0,active,"2.16.840.1.113883.4.642.4.245,2.16.840.1.113883.4.642.2.133,2.16.840.1.113883.4.642.1.240",DocumentRelationshipType,Document Relationship Type,"The type of relationship between documents.","ConceptMap/AssociationTypeVsRelatesTo"
http://hl7.org/fhir/http-verb,5.0.0,active,"2.16.840.1.113883.4.642.4.625,2.16.840.1.113883.4.642.2.329,2.16.840.1.113883.4.642.1.617",HTTPVerb,H T T P Verb,"HTTP verbs (in the HTTP command line). See [HTTP rfc](https://tools.ietf.org/html/rfc7231) for details.","ValueSet/MHDprovideFolderActions,ValueSet/MHDprovidePatientActions"
http://hl7.org/fhir/restful-interaction,5.0.0,active,"2.16.840.1.113883.4.642.4.1823",FHIRRestfulInteractions,FHIR Restful Interactions,"The set of interactions defined by the RESTful part of the FHIR specification.","ValueSet/AllSearchVS,ValueSet/AllReadVS"
http://terminology.hl7.org/CodeSystem/object-role,1.1.0,active,"2.16.840.1.113883.4.642.1.1135",AuditEventEntityRole,AuditEventEntityRole,"Code representing the role the entity played in the audit event.","ValueSet/RestObjectRoles"
http://terminology.hl7.org/CodeSystem/v3-ParticipationType,5.0.0,active,"2.16.840.1.113883.5.90",ParticipationType,ParticipationType,"A code specifying the meaning and purpose of every Participation instance. Each of its values implies specific constraints on the Roles undertaking the participation.","ValueSet/DataSources"
https://profiles.ihe.net/ITI/MHD/CodeSystem/BasicAuditEntityType,5.0.0-comment,active,,BasicAuditEntityType,Entity Types that are defined in IHE BasicAudit,"These are new codes used in BasicAudit IG, where AuditEvent.entity is used to hold a specific kind of data that is not covered by the existing valueSet.","ValueSet/BasicAuditEntityTypesVS"
https://profiles.ihe.net/ITI/MHD/CodeSystem/MHDlistTypes,5.0.0-comment,active,,MHDlistTypes,MHD List Types,"To use the List resource for two different use-cases we define a code-system with the types of List needed in MHD","ValueSet/MHDlistTypesVS"
