URL,Version,Status,OIDs,Name,Title,Description,Uses,Used,Sources
https://profiles.ihe.net/ITI/MHD/ValueSet/AllReadVS,5.0.0,active,,AllReadVS,all Reads,"ValueSet of the restful-interaction reads",,"hl7.fhir.r5.core"
https://profiles.ihe.net/ITI/MHD/ValueSet/AllSearchVS,5.0.0,active,,AllSearchVS,all Searches,"ValueSet of the restful-interaction searches",,"hl7.fhir.r5.core"
https://profiles.ihe.net/ITI/MHD/ValueSet/BasicAuditEntityTypesVS,5.0.0,active,,BasicAuditEntityTypesVS,Entity Types used by IHE BasicAudit,"For use with AuditEvent.entity.type.  This includes codes defined in the BasicAudit.",,"Internal"
https://profiles.ihe.net/ITI/MHD/ValueSet/DataSources,5.0.0,active,,DataSources,participant source types for RESTful create,"create agent participant types for user operators that are in REST",,"THO (V3)"
https://profiles.ihe.net/ITI/MHD/ValueSet/DocumentReferenceStats,5.0.0,active,,DocumentReferenceStats,MHD DocumentReference status codes,"ValueSet that does not include entered-in-error as that does not map",,"hl7.fhir.r5.core"
https://profiles.ihe.net/ITI/MHD/ValueSet/MHDlistTypesVS,5.0.0,active,,MHDlistTypesVS,MHD List Types ValueSet,"ValueSet of the MHD List Types allowed",,"Internal"
https://profiles.ihe.net/ITI/MHD/ValueSet/MHDprovideFolderActions,5.0.0,active,,MHDprovideFolderActions,MHD Folder List Types ValueSet,"A ValueSet of the allowed actions in a ITI-65 Provide Document Bundle for the Folder List type Resources. Where Folders are allowed to be Updated in addition to Created.",,"hl7.fhir.r5.core"
https://profiles.ihe.net/ITI/MHD/ValueSet/MHDprovidePatientActions,5.0.0,active,,MHDprovidePatientActions,MHD Patient Types ValueSet,"A ValueSet of the allowed actions in a ITI-65 Provide Document Bundle for the Patient type Resource. Where Patient would typically be indicated as a GET (read), but might be created or updated depending on policy.",,"hl7.fhir.r5.core"
https://profiles.ihe.net/ITI/MHD/ValueSet/RestObjectRoles,5.0.0,active,,RestObjectRoles,RESTful objects role in the event,"The role that the given Object played in the Audit Event recorded",,"THO"
